{
  "contract_version": 1,
  "suite": "storage_v1",
  "case_id": "schema_mismatch_clears_all",
  "now_ms": 1739923200000,
  "input": {
    "schema_version": 1,
    "current_schema": 2,
    "namespace": "a_acc123:p_prof55:",
    "writes": [
      {
        "key": "settings.playback",
        "value": {
          "engine": "exo"
        }
      }
    ]
  },
  "expected": {
    "should_clear_all": true,
    "keys_written": [
      "a_acc123:p_prof55:settings.playback"
    ]
  }
}
